url,title,body,published,length,source,language
https://www.independent.co.uk/sport/boxing/ricky-hatton-death-cause-tributes-manchester-boxing-latest-news-b2826218.html,Ricky Hatton death: Legendary British boxer found dead aged 46 as tributes pour in,"Multiple world champion Hatton was found dead in his Manchester home on Sunday morning British boxing icon Ricky Hatton has died at the age of 46 after his body was found in his home in Greater Manchester on Sunday morning. Hatton was perhaps the most popular British boxer of all-time, with his raucous fanbase regularly travelling across the Atlantic in their thousands to watch him fight the likes of Floyd Mayweather and Manny Pacquiao in some of the biggest bouts in British boxing history. He held multiple world titles in the light-welterweight and welterweight divisions during a storied boxing career, having first claimed one by beating Kosta Tszyu on a remarkable night at the MEN Arena in his home city of Manchester in 2005. Hatton had spoken candidly about his mental health struggles and battle with addiction and police found his body at his home in Hyde at 6:45am on Sunday morning. Greater Manchester Police are not treating the death as suspicious Follow all the latest updates and tributes following his passing below: Hatton produced one of the most storied and impressive career’s in British boxing history, winning 45 of his 48 professional bouts across 15 years. Memorable moments for ""The Hitman"" included title wins against Kostya Tszyu (in 2005 for the IBF and The Ring light-welterweight titles) and Jose Luis Castillo (in 2007 for the vacant WBC International light-welterweight title), while he also beat Juan Urango for the IBF and vacant IBO light-welterweight titles. Of his three losses, two came to a pair of the greatest boxers of all time in Floyd Mayweather Jr. and Manny Pacquiao. His last loss came in his final professional bout, to Ukraine's Vyacheslav Senchenko in 2012. Hatton had recently announced his return to boxing, having lined up a fight with the UAE’s Eisa Al Dah on 2 December. Many of the boxing’s biggest figures have paid tribute to Hatton as the news broke. Amir Khan said on X that “today we lost not only one of Britain's greatest boxers, but a friend, a mentor, a warrior”. ""Rest well, Ricky. You'll always have your place in the ring of our memories,” he adds. On Instagram, Tyson Fury said: “Rip to the legend Ricky Hatton may he rip. ""There will only ever be 1 Ricky Hatton. Can't believe this so young."" The full statement from Greater Manchester Police is below. It reads: “ Officers were called by a member of the public to attend Bowlacre Road, Hyde, Tameside, at 6:45am today where they found the body of a 46-year-old man. There are not currently believed to be any suspicious circumstances."" British boxing legend Ricky Hatton has died at the age 46 after being found at his home in Hyde, Greater Manchester. Hatton, who held multiple world championships in the light-welterweight division, as well as one at welterweight during a storied boxing career was one of the most iconic and popular British boxers of all time. A police cordon is in place around his home and Greater Manchester Police confirmed that a body had been found at Hatton's address and that the death was not being treated as suspicious. Sad news to bring you this afternoon. British boxing legend Ricky Hatton has died at the age 46 after being found at his home in Hyde, Greater Manchester. Hatton was one of the most iconic and popular British boxers of all time, and a multiple world championship title holder in the light-welterweight division. He also won one welterweight title during a storied boxing career that included fights against Floyd Mayweather Jr, Manny Pacquiao and Paulie Malignaggi. Greater Manchester Police confirmed that a body had been found at Hatton's address and that the death was not being treated as suspicious. Join thought-provoking conversations, follow other Independent readers and see their replies",2025-09-14 12:30:28,3775,independent.co.uk,en
https://www.independent.co.uk/news/uk/politics/keir-starmer-lord-mandelson-sacking-b2826160.html,"Mandelson appointment ‘worth the risk’ despite Epstein ties due to his ‘singular talent’, minister says","Business secretary Peter Kyle claimed that Lord Mandelson’s abilities meant the ‘political consideration’ outweighed the concerns about him I would like to be emailed about offers, events and updates from The Independent. Read our Privacy notice A senior cabinet minister has admitted that “political considerations” about Peter Mandelson ’s “outstanding singular talents” meant security concerns about the Labour peer being made ambassador to the US were ignored. Business secretary Peter Kyle repeated the claim on Sky News and BBC on Sunday morning that “new information” coming to light over Lord Mandelson’s relationship with the convicted paedophile Jeffrey Epstein led to his sacking on Friday. Last week The Independent revealed that Sir Keir pushed through his appointment earlier this year despite failing security vetting by MI6 . Mr Kyle refused to say if the prime minister spoke to Lord Mandelson directly to let him know he was sacked, nor whether the appointment had been a mistake in the first place. Mr Kyle told Sunday Morning With Trevor Phillips on Sky News it was not correct that Lord Mandelson was appointed ambassador to the US before security checks were completed. He said: “The Cabinet Office did an independent inquiry into the appointment, as they do in every public appointment of this nature, and the information... was presented to the prime minister.” But he admitted that political considerations trumped security concerns about Lord Mandelson, which included not only his relationship with Epstein but also his links to China. In January, The Independent revealed that the same concerns almost led to Donald Trump refusing Lord Mandelson’s credentials. Mr Kyle said: “The second process was obviously a political process where there are political conversations done in No 10 about all the other aspects of an appointment of this nature. Now, both of these things turned up information that was already public, and a decision was made that, based on Peter’s singular talents in this area, that the risk of appointing knowing what was already public was worth the risk.” But he added on Laura Kuenssberg’s Sunday morning BBC show that Lord Mandelson’s appointment had achieved a lot for the UK. He said: “[At the time of the appointment] global norms were turned upside down. The relationship between Britain and America was in a perilous state because of the threat of tariffs. What was happening economically, trying to repurpose and rethink the special relationship. Britain needed somebody with outstanding, singular talents, experience which was very hard to come by.” Explaining the “new information,” Mr Kyle claimed the vetting did not pick up emails that came to light this week showing Lord Mandelson advising Epstein on tackling his conviction, and calling the financier his “best pal”. He added: “Of course we have seen the emails which were not published at the time, were not public and not even known about, and that has changed the situation.” “They had what was public, which was extracts of the emails and... immediately, upon having been alerted to extracts of emails, the Foreign Office contacted Peter Mandelson and asked for his account of the emails and asked for them to be put into context and for his response. That response did not come before PMQs, and then, after PMQs, the full emails were released by Bloomberg in the evening. “By the first thing next morning, when the Prime Minister had time to read the emails in full... almost immediately... Peter was withdrawn as ambassador.” Mr Kyle stressed that the media had the “same information that we had at the time” of the appointment. Opponents said it was “astonishing” that Lord Mandelson’s talents would take precedence over both security concerns and Epstein’s victims. Tory chairman Kevin Hollinrake said: “It is astonishing that the new business and trade secretary has openly admitted that Downing Street chose to prioritise Mandelson’s ‘singular and outstanding talents’ over the rights of Epstein’s victims. Even more damning, this cover-up appears to have continued for a further 48 hours this week as more and more revelations came to light.” Tory leader Kemi Badenoch said she would demand that the prime minister make a statement on the fiasco to the Commons on Monday. She said: “Our weak prime minister is hiding, sending out ministers to answer for his terrible judgement. The last time we saw Starmer was Wednesday, when he told me he had confidence in Mandelson. The PM needs to come to Parliament tomorrow and tell the truth about what he knew and when.” Join thought-provoking conversations, follow other Independent readers and see their replies",2025-09-14 13:15:01,4681,independent.co.uk,en
https://www.independent.co.uk/news/uk/home-news/london-protests-live-tommy-robinson-unite-the-kingdom-march-news-b2825881.html,London protests latest: Musk’s speech at Tommy Robinson march denounced as ‘disgusting and inappropriate’,"Among comments made in conversation with Robinson, Musk claimed a ‘dissolution of parliament’ and ‘change of government’ is needed in the UK I would like to be emailed about offers, events and updates from The Independent. Read our Privacy notice Elon Musk’s speech at a march organised by Tommy Robinson – in which he told attendees to “either fight back or you die” – has been denounced as “inappropriate” and “disgusting”. The X owner claimed a “dissolution of parliament” and a “change of government” is needed in the UK when he appeared via video link at the huge march on Saturday in London. The speech has sparked criticism, including from the business secretary Peter Kyle, who said the comments were “slightly incomprehensible” and “totally inappropriate”. A Labour source also said that politicians who believe in democracy “should distance themselves from these disgusting comments”. Between 110,000 to 150,000 protesters were estimated to have joined the “Unite the Kingdom” rally , while the Metropolitan Police said around 5,000 people were at an anti-racism counter-protest organised by Stand Up To Racism (SUTR), with over 1,000 officers deployed in a bid to prevent clashes. The force said 25 people have been arrested so far, after 26 officers were injured – including four who were seriously hurt – in scenes of “unacceptable violence”. In 2018, he was jailed for 13 months for breaking contempt of court laws with a Facebook Live video that could have prejudiced a trial. He was already subject to a suspended sentence for committing contempt during a rape trial in Canterbury the year before. Three years later, as The Independent investigated reports he misused donors’ cash, he shouted abuse at the home of the journalist involved , defamed her partner and threatened to return. Convicted of stalking, he was banned from contacting them for five years. In 2022, he spent £100,000 gambling before declaring bankruptcy , the High Court heard. Amid the far-right riots in summer 2024, Robinson organised what he claimed would be the “biggest patriotic rally the UK has ever seen”. Thousands of Robinson’s supporters gathered in central London for the counter-protest to a Stand Up To Racism march. But Robinson missed his own event after being arrested in July 2024 under anti-terror laws over allegations he breached a 2021 High Court order. The order banned Robinson from repeating libellous allegations he made against Syrian refugee Jamal Hijazi. Robinson was later jailed for 18 months in October 2024. In April 2025, Tommy Robinson lost an appeal to reduce his jail term over claims prison segregation was “making him ill”. However, he was released in May 2025, after his sentence was reduced by four months at the High Court. The prime minister has said he “will not stand” for violence against police or for people feeling “intimidated on our streets” after yesterday’s march. Sir Keir Starmer said that he will “never surrender” the use of the British flag to be used as a “symbol of violence, fear and division”. He wrote on X: “People have a right to peaceful protest. It is core to our country’s values. “But we will not stand for assaults on police officers doing their job or for people feeling intimidated on our streets because of their background or the colour of their skin. “Britain is a nation proudly built on tolerance, diversity and respect. “Our flag represents our diverse country and we will never surrender it to those that use it as a symbol of violence, fear and division.” The Tommy Robinson protest is ""one of the biggest far right marches in British history"" and ""an urgent wake-up call for us all"", according to the antiracist group Stand Up to Racism. Police estimates suggest the protest gathered over 100,000 people. This is ""the biggest number of people"" Tommy Robinson has mobilised, ""and goes beyond his usual base,"" the group warned. ""We need far bigger numbers. We need hundreds of thousands,"" the group said, calling for ""campaigners, trade unionists, politicians, faith groups and others"" to come together to build the unity needed to ""stop the far right on the streets and at the ballot box"". Keir Starmer was spotted at the Emirates Stadium in London on Saturday, as violent clashes broke out between police and demonstrators in the centre of the city. The prime minister and his son were seen in the stands watching his favourite football team Arsenal play against Nottingham Forest in a Premier League match. The frontman of the band James has said the group is examining its options after Tommy Robinson used its song in a video without permission. The far-right figure used the indie band’s smash hit ‘Sit Down’ in a video posted on X to highlight the size of the protest he organised in London on Saturday . But James frontman Tim Booth hit back in his own post on X, describing the far-right rally as the “antithesis” of what his band’s song stands for. He wrote: “Disgusted to see the cynical use of ‘Sit Down’ by @TRobinsonNewEra. “No permission was granted, and we are looking into our options. “The song and most of our topical lyrics, make it very clear where we stand, and it’s the antithesis of this organization.” As well as Elon Musk appearing on a video, the “Unite” protest featured speeches from Tommy Robinson and other activists, including former actor Laurence Fox, former Apprentice candidate Katie Hopkins, along with musical performers. It also featured far-right French politician Eric Zemmour, who came in fourth place in the first round of the 2022 French presidential election; leader of the Danish People’s Party Morten Messerschmidt; Petr Bystron of the far-right Alternative for Germany party; Polish right-wing politician Dominik Tarczynski; Belgian anti-immigration activist Filip Dewinter; and television personality Ant Middleton who is running to be Mayor of London. The Met Police have stepped in to correct misinformation posted by X’s AI ‘Grok’ tool. One X user posted a video of ‘Unite the Kingdom’ protesters clashing with police at yesterday’s rally, and asked ‘Grok’ when and where the footage was taken. ‘Grok’ replied: “This footage appears to be from an anti-lockdown protest in London's Trafalgar Square on September 26, 2020, during clashes between demonstrators and police over COVID restrictions.” The Met Police replied stating: “The footage was filmed yesterday, shortly before 3pm, at the junction of Whitehall and Horse Guards Avenue in Westminster. It is not from 2020 and does not show Trafalgar Square.” It also shared its original post from Saturday.",2025-09-14 15:54:27,6573,independent.co.uk,en
https://www.chinadaily.com.cn/a/202509/14/WS68c6d913a3108622abca0a8f.html,Winners of Golden Panda Awards announced,"There's Still Tomorrow, a feminist comedy about a working-class woman fighting gender violence in postwar Italy of the 1940s, which was a huge box-office hit in the country in 2023, won the Best Picture honor at the second Golden Panda Awards held over the weekend in Chengdu, Sichuan province. Conveying her appreciation, the film's director, Paola Cortellesi, said the recognition in China serves as a reminder that ""cinema has the power to connect us beyond borders, languages and cultures"". The winners of the Golden Panda Awards — a biennial event that promotes mutual learning and exchanges among human civilizations — were announced on Saturday night. Director Chen Kaige, jury president of the Awards, told China Daily that the event has encouraged more foreign filmmakers and TV producers to appreciate the China story, especially as global recognition of China has grown thanks to more than four decades of reform and opening-up. ""Films and television often evolve alongside a country's development. For those interested in understanding how a nation grows stronger, screen works can provide some insights. Today, China has an opportunity to show foreign audiences its long-term development through its films and dramas,"" he said. A total of 27 awards — 25 across four categories in film, TV drama, animation and documentary, as well as two Special Jury awards — were selected from 5,343 submissions from 126 countries and regions. Among these, 3,910 were foreign titles, accounting for 73.2 percent of the total. While the Best Actor award in the film category went to Zhu Yilong for his appearance in the noir crime thriller Only the River Flows, Brazilian actress Denise Weinberg took home the Best Actress prize for her role in the dystopian drama The Blue Trail. Describing the event as a bridge connecting Chinese filmmakers to the world, Zhu said he was thrilled to be recognized on the inclusive stage. Perhaps one of the most emotional moments of the awards ceremony was when late filmmaker Pema Tseden — a pioneering figure in Tibetan-language cinema — was honored with the Best Director award for the arthouse film Snow Leopard. Tseden died of a sudden illness at the age of 53 in 2023. Jigme Trinley, Pema Tseden's son and executive director on Snow Leopard, accepted the trophy on behalf of his father, saying the honor was a tribute to his father's artistic life. ""Snow Leopard is my father's eighth Tibetan-language film, condensing his experiences, thoughts and reflections of his entire life, carrying the strength of love and mercy beyond time and space,"" he said. Turkish filmmaker Nuri Bilge Ceylan, along with two fellow writers, won the Best Screenplay award for About Dry Grasses, which explores the emotional struggle of a teacher in a remote Turkish village. Having visited China multiple times in recent years, including serving as jury president of the Shanghai International Film Festival in 2019, Ceylan revealed that his award-winning film is based on the memories of co-writer Akin Aksu, who kept diaries to document his three-year compulsory service as a teacher in Anatolia. In the TV drama category, She and Her Girls — a 23-episode biographical tale chronicling the life of a dedicated teacher — bagged two awards: Best TV Drama and Best Screenplay. The series is adapted from the true story of Zhang Guimei, who founded the country's first free all-girls high school in Yunnan province, helping over 2,000 rural girls realize their college dreams. Scriptwriter Yuan Zidan, who described the drama as ""a very important work"" in her more than 20 years of writing, said the story allowed her to witness the highest expression of noble humanity. Despite poor living conditions and battling multiple diseases, Zhang persevered with her passion and love for education, added Yuan. While James Strong won Best Director in the TV drama category for the British series Mr Bates vs The Post Office, the Best Actress prize went to Tang Yan for her role as a dynamic woman in Blossoms Shanghai, a drama set against the backdrop of the Chinese financial market's early prosperity. Hong Kong actor Francis Ng bagged the Best Actor honor for his vivid portrayal of a determined broker in Escape from the Trilateral Slopes, depicting the fight against drug trafficking. For the other two categories, the Best Animation prize went to Ne Zha 2, China's highest-grossing blockbuster of all times, while Norwegian production A New Kind of Wilderness took home the Best Documentary award. The two-day event, held on Sept 12 and 13, drew over 600 celebrities and industry insiders from home and abroad, turning Chengdu — famous for its spicy hotpots and giant pandas — into a carnival for creators of stories from different cultures and civilizations. British television producer Mal Young, chairman of the TV drama category jury, told China Daily that the event has encouraged collaboration, helping him establish connections with many actors, writers and directors in China. The Liverpool native added that he has now become a fan of China after spending a few days watching the nominated television shows, which provided him with insights like never before. American visual effects artist Joel Hynek, a juror for the TV drama category, said that China displays a very high level of expertise. ""Bringing all these people from around the world together here is a great way to foster connections and mutual understanding across different cultures,"" he said.",,5481,chinadaily.com.cn,en
https://www.chinadaily.com.cn/a/202509/13/WS68c4c816a3108622abca091e.html,Qing Bao's 4th birthday party warms hearts at Washington zoo,"A lively crowd gathered at the Smithsonian's National Zoo in Washington, DC, on Friday to celebrate Qing Bao's fourth birthday. The female giant panda, who arrived from China last October, celebrated her first birthday at the zoo with a fun-filled event, drawing visitors from around the world. Staff set the scene with honey-smeared ""gift boxes"" filled with sweet potatoes, scattered carrots, and playful balls for Qing Bao. The highlight was a fruit-and-ice cake, featuring a large ""4"" and ice heart, brought in by keepers. When Qing Bao entered, she first showed interest in the carrots and played with a ball before the cake drew her attention. Her first bite was met with a chorus of ""Happy Birthday"" from the crowd. After enjoying the treats, she climbed a tree to rest, drawing ""awws"" and smiles from the audience. In recent weeks, Qing Bao showed signs of pseudopregnancy, a condition where female pandas exhibit pregnancy-like symptoms, such as sleeping more and being sensitive to noise, despite not being pregnant. According to the zoo, keepers kept a close eye on her during the celebrations. Bao Li, Qing Bao's male companion, celebrated his fourth birthday on Aug 4, also enjoying a colorful frozen fruit cake. ""It was fun watching her soon-to-be mate have his birthday a few weeks ago when he turned four. And now she's four,"" said longtime zoo visitor Craig Salvas to China Daily. Visitors shared touching stories of how pandas have become a part of their lives, igniting joy and forging connections. Panda enthusiast Stephanie Smith expressed her heartfelt affection for Qing Bao. ""We love you so much,"" she proclaimed, recalling meeting Qing Bao's father as a cub and Tai Shan, the cub of former zoo panda residents Mei Xiang and Tian Tian, in Dujiangyan, China. Tai Shan was born in 2005 and returned to China in 2010. ""You've made my life so special. You make all of our lives special … and I can't say thank you enough,"" said Smith, offering blessings to Qing Bao and other pandas. Sanpetch, a software developer who accompanied his wife, brought a professional camera to capture the moment. He said they visited Qing Bao earlier this year in March and April, returning for her birthday. ""They're just lovely animals. Wonderful,"" Sanpetch said. ""Happy birthday. She looks wonderful."" Craig Salvas has a decades-long bond with the zoo's pandas. ""I have been coming here since the first pandas came to this zoo in 1973, Ling-Ling and Hsing-Hsing, and watched them grow up, grow old here,"" he said. ""And then when Mei Xiang and Tian Tian came in 2000, watched them grow up and have four babies: Tai Shan, Bao Bao, Bei Bei and Xiao Qi Ji."" The older three cubs returned to China for breeding programs, while Xiao Qi Ji left with his parents in 2023 when their agreement expired. ""And then when they left with Xiao Qi Ji, then Qing Bao and Bao Li came here. So now we have those two pandas, and hopefully they'll have babies in a little while, and we'll watch them grow up,"" he said.",,2999,chinadaily.com.cn,en
