url,title,body,published,length,source,language
https://www.scmp.com/news/china/science/article/3325470/or-out-death-bright-young-scientists-highlights-chinas-ruthless-academic-system?module=top_story&pgtype=homepage,‘Up or out’: death of bright young scientists highlights China’s ruthless academic system,"As China’s innovation and self-reliance drive shifts into high gear, experts say revamping ecosystem may overlook well-being of people in it While none of their institutions has issued any official statement about the deaths, the cases have once again prompted criticism of China’s flawed talent system, which is characterised by cutthroat competition that can push young academics to the limits. Issues within China’s academic system include an “up or out” tenure race, dwindling chances to get funding and a crushing workload. Guo Yingjian, professor of English at Renmin University of China in Beijing, said “such a high number of cases involving the untimely deaths of young scholars” was not evident in other countries. ‘Made in China 2025’: how has the nation changed 10 years after setting its manufacturing blueprint?",2025-09-14 14:00:09,825,scmp.com,en
https://www.scmp.com/economy/global-economy/article/3325494/china-us-trade-delegations-kick-fourth-round-talks-madrid?module=top_story&pgtype=homepage,"China, US trade delegations kick off fourth round of talks in Madrid","Amid continued trade tensions, top teams from world’s two largest economies are meeting in Madrid in their latest effort to reach a deal The delegations arrived at the Spanish foreign ministry in central Madrid on Sunday afternoon local time, just hours after the Chinese team touched down in the capital. A dozen journalists from Chinese and European outlets, including Spain’s public broadcaster TVE, had gathered outside the ministry building in the heart of the tourist area. They drew curious glances from passers-by and locals at nearby cafe terraces. Prime Minister Pedro Sánchez is in the south of the country attending a gathering of his Spanish Socialist Workers’ Party. This is the fourth time He and Bessent are meeting face to face in Europe, as both sides strive to sort out mounting trade disagreements since US President Donald Trump renewed his tariff war in April.",2025-09-14 12:08:16,882,scmp.com,en
https://www.scmp.com/news/china/military/article/3325481/china-holds-routine-patrol-south-china-sea-it-warns-philippines-tensions?module=top_story&pgtype=homepage,"Chinese military holds ‘routine’ South China Sea patrol, warns the Philippines on tensions","Manila should ‘stop provocations’, PLA says, days after Beijing announced plans to build nature reserve on contested Scarborough Shoal Tian criticised Manila for “spreading illegal claims in the South China Sea and undermining regional peace and stability”, adding that theatre troops “remain on high alert, firmly safeguarding national sovereignty and security”. “Any attempt to stir up trouble will not succeed,” he said. Manila cries foul over Beijing’s nature reserve plan in South China Sea",2025-09-14 08:00:21,495,scmp.com,en
https://www.lemonde.fr/politique/article/2025/09/14/a-la-fete-de-l-humanite-les-insoumis-en-terrain-conquis-fustigent-les-socialistes_6641169_823448.html,"A la Fête de « L’Humanité », les « insoumis », en terrain conquis, fustigent les socialistes","Reportage Les dissensions entre LFI et le PS ont rythmé les trois jours de rassemblement sur fond de désaccord dans la conduite à tenir face au nouveau premier ministre, Sébastien Lecornu. Une gauche qui s’écharpe devant des militants qui crient à l’unité : la gauche a offert un drôle de spectacle à la 90 e édition de la Fête de L’Humanité , qui s’est tenue au Plessis-Pâté (Essonne) du vendredi 12 au dimanche 14 septembre. Fil rouge de ces trois journées, les dissensions entre le Parti socialiste (PS) et les « insoumis ». En terrain conquis sur cette ancienne base aérienne de l’Essonne, le mouvement de Jean-Luc Mélenchon a déployé ses meilleurs efforts pour torpiller le PS et pour briser sa bonne entente avec Les Ecologistes et le Parti communiste (PCF). Une longue passe d’armes a eu lieu samedi en direct sous le chapiteau de l’agora lors d’un débat unitaire. Avant même de dire un mot, le premier secrétaire du PS, Olivier Faure, a été hué par le public. « Vendu » , « trahison » , a-t-on entendu dans les travées bondées. « Quelles sont les raisons qui vous poussent à me nuire alors que je n’ai pas parlé ? » , a interrogé le député de Seine-et-Marne. Galvanisé, le député La France insoumise (LFI) de Haute-Garonne Hadrien Clouet a décoché plusieurs flèches à son endroit. Sans le nommer, il l’a invité « à ne pas glisser dans l’union bourgeoise » ou vers « un macronisme finissant » et a fustigé les « contre-budgets capitulards ». Allusion à la stratégie du parti à la rose, dont le budget alternatif ne reprend pas les mesures du Nouveau Front populaire (NFP). Il vous reste 81.29% de cet article à lire. La suite est réservée aux abonnés. Lecture du Monde en cours sur un autre appareil. Vous pouvez lire Le Monde sur un seul appareil à la fois Ce message s’affichera sur l’autre appareil. Parce qu’une autre personne (ou vous) est en train de lire Le Monde avec ce compte sur un autre appareil. Vous ne pouvez lire Le Monde que sur un seul appareil à la fois (ordinateur, téléphone ou tablette). En cliquant sur « Continuer à lire ici » et en vous assurant que vous êtes la seule personne à consulter Le Monde avec ce compte. Nous vous conseillons de modifier votre mot de passe . Que se passera-t-il si vous continuez à lire ici ? Ce message s’affichera sur l’autre appareil. Ce dernier restera connecté avec ce compte. Non. Vous pouvez vous connecter avec votre compte sur autant d’appareils que vous le souhaitez, mais en les utilisant à des moments différents. Parce qu’une autre personne (ou vous) est en train de lire Le Monde avec ce compte sur un autre appareil. Vous ne pouvez lire Le Monde que sur un seul appareil à la fois (ordinateur, téléphone ou tablette). Si vous utilisez ce compte à plusieurs, créez un compte pour votre proche (inclus dans votre abonnement). Puis connectez-vous chacun avec vos identifiants. Sinon, cliquez sur « Continuer à lire ici » et assurez-vous que vous êtes la seule personne à consulter Le Monde avec ce compte. Vous ignorez qui d’autre utilise ces identifiants ? Nous vous conseillons de modifier votre mot de passe . Que se passera-t-il si vous continuez à lire ici ? Ce message s’affichera sur l’autre appareil. Ce dernier restera connecté avec ce compte. Non. Vous pouvez vous connecter avec votre compte sur autant d’appareils que vous le souhaitez, mais en les utilisant à des moments différents. Parce qu’une autre personne (ou vous) est en train de lire Le Monde avec ce compte sur un autre appareil. Vous ne pouvez lire Le Monde que sur un seul appareil à la fois (ordinateur, téléphone ou tablette). Si vous êtes bénéficiaire de l’abonnement, connectez-vous avec vos identifiants. Si vous êtes 3 ou plus à utiliser l’abonnement, passez à l’offre Famille . Sinon, cliquez sur « Continuer à lire ici » et assurez-vous que vous êtes la seule personne à consulter Le Monde avec ce compte. Vous ignorez qui d’autre utilise ces identifiants ? Nous vous conseillons de modifier votre mot de passe . Que se passera-t-il si vous continuez à lire ici ? Ce message s’affichera sur l’autre appareil. Ce dernier restera connecté avec ce compte. Non. Vous pouvez vous connecter avec votre compte sur autant d’appareils que vous le souhaitez, mais en les utilisant à des moments différents. Parce qu’une autre personne (ou vous) est en train de lire Le Monde avec ce compte sur un autre appareil. Vous ne pouvez lire Le Monde que sur un seul appareil à la fois (ordinateur, téléphone ou tablette). Si vous êtes bénéficiaire de l’abonnement, connectez-vous avec vos identifiants. Sinon, cliquez sur « Continuer à lire ici » et assurez-vous que vous êtes la seule personne à consulter Le Monde avec ce compte. Vous ignorez qui d’autre utilise ce compte ? Nous vous conseillons de modifier votre mot de passe . Que se passera-t-il si vous continuez à lire ici ? Ce message s’affichera sur l’autre appareil. Ce dernier restera connecté avec ce compte. Non. Vous pouvez vous connecter avec votre compte sur autant d’appareils que vous le souhaitez, mais en les utilisant à des moments différents. Parce qu’une autre personne (ou vous) est en train de lire Le Monde avec ce compte sur un autre appareil. Vous ne pouvez lire Le Monde que sur un seul appareil à la fois (ordinateur, téléphone ou tablette). Si vous utilisez ce compte à plusieurs, passez à une offre multicomptes pour faire profiter vos proches de votre abonnement avec leur propre compte. Sinon, cliquez sur « Continuer à lire ici » et assurez-vous que vous êtes la seule personne à consulter Le Monde avec ce compte. Vous ignorez qui d’autre utilise ce compte ? Nous vous conseillons de modifier votre mot de passe . Que se passera-t-il si vous continuez à lire ici ? Ce message s’affichera sur l’autre appareil. Ce dernier restera connecté avec ce compte. Non. Vous pouvez vous connecter avec votre compte sur autant d’appareils que vous le souhaitez, mais en les utilisant à des moments différents. Parce qu’une autre personne (ou vous) est en train de lire Le Monde avec ce compte sur un autre appareil. Vous ne pouvez lire Le Monde que sur un seul appareil à la fois (ordinateur, téléphone ou tablette). En cliquant sur « Continuer à lire ici » et en vous assurant que vous êtes la seule personne à consulter Le Monde avec ce compte. Que se passera-t-il si vous continuez à lire ici ? Ce message s’affichera sur l’autre appareil. Ce dernier restera connecté avec ce compte. Non. Vous pouvez vous connecter avec votre compte sur autant d’appareils que vous le souhaitez, mais en les utilisant à des moments différents. Nous vous conseillons de modifier votre mot de passe . Votre abonnement n’autorise pas la lecture de cet article Pour plus d’informations, merci de contacter notre service commercial.",2025-09-14 00:00:00,6726,lemonde.fr,fr
https://www.lemonde.fr/economie/article/2025/09/14/la-folie-des-labubu-et-des-jouets-collectionnables-gagne-la-france_6641140_3234.html,"« C’est moche, mais, comme c’est mignon, les gens achètent quand même » : les Labubu, ces figurines en peluche devenues un phénomène de mode en France","Elles font fureur en Chine et, depuis quelques mois, en France comme aux Etats-Unis. Les Labubu – prononcer « laboubou » – font de plus en plus d’adeptes chez les jeunes adultes. Imaginée par l’illustrateur hongkongais Kasing Lung, cette collection de personnages avec des oreilles de lapin, des dents aiguisées et de grands yeux hallucinés, est commercialisée en France, depuis 2023, par la marque chinoise Pop Mart, spécialisée dans la pop culture et les figurines, dans sa gamme « The Monsters ». Les Labubu sont passés au rang de phénomène de mode au début de l’année, notamment leur version porte-clés en peluche. Popularisés par des stars internationales comme Rihanna, Dua Lipa ou Lisa, du groupe sud-coréen Blackpink, mais aussi des rappeurs français. Il n’en fallait pas davantage pour que la labubumania ne se propage sur les réseaux sociaux . « C’est moche, mais, comme c’est mignon, les gens achètent quand même » , explique Frédérique Tutt chez Circana, qui range ces petits doudous dans la catégorie des « produits moche cute » . Difficile de connaître le chiffre des ventes en France, Pop Mart refusant de communiquer ses données. Mais dans ses magasins, pour le moment unique distributeurs des porte-clés en peluche de multiples couleurs à 20 euros pièce, le succès est tel qu’il est difficile de s’en procurer. « Depuis le 26 mai, on ne vend les Labubu que par tirage au sort , explique Julie (qui n’a pas souhaité donner son nom de famille), vendeuse dans la boutique Pop Mart du centre commercial des Halles à Paris. Il faut scanner le QR code à l’entrée pour s’inscrire en ligne, le vendredi à partir de 17 heures, et, le lundi, vous recevrez un e-mail qui vous dira si vous êtes éligible. » Il vous reste 70.22% de cet article à lire. La suite est réservée aux abonnés. Lecture du Monde en cours sur un autre appareil. Vous pouvez lire Le Monde sur un seul appareil à la fois Ce message s’affichera sur l’autre appareil. Parce qu’une autre personne (ou vous) est en train de lire Le Monde avec ce compte sur un autre appareil. Vous ne pouvez lire Le Monde que sur un seul appareil à la fois (ordinateur, téléphone ou tablette). En cliquant sur « Continuer à lire ici » et en vous assurant que vous êtes la seule personne à consulter Le Monde avec ce compte. Nous vous conseillons de modifier votre mot de passe . Que se passera-t-il si vous continuez à lire ici ? Ce message s’affichera sur l’autre appareil. Ce dernier restera connecté avec ce compte. Non. Vous pouvez vous connecter avec votre compte sur autant d’appareils que vous le souhaitez, mais en les utilisant à des moments différents. Parce qu’une autre personne (ou vous) est en train de lire Le Monde avec ce compte sur un autre appareil. Vous ne pouvez lire Le Monde que sur un seul appareil à la fois (ordinateur, téléphone ou tablette). Si vous utilisez ce compte à plusieurs, créez un compte pour votre proche (inclus dans votre abonnement). Puis connectez-vous chacun avec vos identifiants. Sinon, cliquez sur « Continuer à lire ici » et assurez-vous que vous êtes la seule personne à consulter Le Monde avec ce compte. Vous ignorez qui d’autre utilise ces identifiants ? Nous vous conseillons de modifier votre mot de passe . Que se passera-t-il si vous continuez à lire ici ? Ce message s’affichera sur l’autre appareil. Ce dernier restera connecté avec ce compte. Non. Vous pouvez vous connecter avec votre compte sur autant d’appareils que vous le souhaitez, mais en les utilisant à des moments différents. Parce qu’une autre personne (ou vous) est en train de lire Le Monde avec ce compte sur un autre appareil. Vous ne pouvez lire Le Monde que sur un seul appareil à la fois (ordinateur, téléphone ou tablette). Si vous êtes bénéficiaire de l’abonnement, connectez-vous avec vos identifiants. Si vous êtes 3 ou plus à utiliser l’abonnement, passez à l’offre Famille . Sinon, cliquez sur « Continuer à lire ici » et assurez-vous que vous êtes la seule personne à consulter Le Monde avec ce compte. Vous ignorez qui d’autre utilise ces identifiants ? Nous vous conseillons de modifier votre mot de passe . Que se passera-t-il si vous continuez à lire ici ? Ce message s’affichera sur l’autre appareil. Ce dernier restera connecté avec ce compte. Non. Vous pouvez vous connecter avec votre compte sur autant d’appareils que vous le souhaitez, mais en les utilisant à des moments différents. Parce qu’une autre personne (ou vous) est en train de lire Le Monde avec ce compte sur un autre appareil. Vous ne pouvez lire Le Monde que sur un seul appareil à la fois (ordinateur, téléphone ou tablette). Si vous êtes bénéficiaire de l’abonnement, connectez-vous avec vos identifiants. Sinon, cliquez sur « Continuer à lire ici » et assurez-vous que vous êtes la seule personne à consulter Le Monde avec ce compte. Vous ignorez qui d’autre utilise ce compte ? Nous vous conseillons de modifier votre mot de passe . Que se passera-t-il si vous continuez à lire ici ? Ce message s’affichera sur l’autre appareil. Ce dernier restera connecté avec ce compte. Non. Vous pouvez vous connecter avec votre compte sur autant d’appareils que vous le souhaitez, mais en les utilisant à des moments différents. Parce qu’une autre personne (ou vous) est en train de lire Le Monde avec ce compte sur un autre appareil. Vous ne pouvez lire Le Monde que sur un seul appareil à la fois (ordinateur, téléphone ou tablette). Si vous utilisez ce compte à plusieurs, passez à une offre multicomptes pour faire profiter vos proches de votre abonnement avec leur propre compte. Sinon, cliquez sur « Continuer à lire ici » et assurez-vous que vous êtes la seule personne à consulter Le Monde avec ce compte. Vous ignorez qui d’autre utilise ce compte ? Nous vous conseillons de modifier votre mot de passe . Que se passera-t-il si vous continuez à lire ici ? Ce message s’affichera sur l’autre appareil. Ce dernier restera connecté avec ce compte. Non. Vous pouvez vous connecter avec votre compte sur autant d’appareils que vous le souhaitez, mais en les utilisant à des moments différents. Parce qu’une autre personne (ou vous) est en train de lire Le Monde avec ce compte sur un autre appareil. Vous ne pouvez lire Le Monde que sur un seul appareil à la fois (ordinateur, téléphone ou tablette). En cliquant sur « Continuer à lire ici » et en vous assurant que vous êtes la seule personne à consulter Le Monde avec ce compte. Que se passera-t-il si vous continuez à lire ici ? Ce message s’affichera sur l’autre appareil. Ce dernier restera connecté avec ce compte. Non. Vous pouvez vous connecter avec votre compte sur autant d’appareils que vous le souhaitez, mais en les utilisant à des moments différents. Nous vous conseillons de modifier votre mot de passe . Votre abonnement n’autorise pas la lecture de cet article Pour plus d’informations, merci de contacter notre service commercial.",2025-09-14 13:41:00,6858,lemonde.fr,fr
https://www.lemonde.fr/economie/article/2025/09/03/aux-etats-unis-google-echappe-au-demantelement_6638494_3234.html,Google échappe au démantèlement aux Etats-Unis,"Par Arnaud Leparmentier (San Francisco, correspondant) Un an après avoir estimé que Google disposait d’un monopole avec son navigateur Chrome, le juge fédéral de Washington Amit Mehta a estimé que la firme devrait céder ses résultats de recherche et certaines données à des entreprises concurrentes, mais qu’elle n’aurait pas besoin de se scinder. Le groupe échappe au démantèlement. Cette décision, rendue mardi 2 septembre, est bien moins sévère que ce que demandait le ministère fédéral de la justice – il exigeait que l’entreprise se sépare de Chrome . Elle constitue un revers pour l’administration Trump, qui avait engagé les poursuites en 2020, mais aussi pour celle de Joe Biden, qui avait poursuivi ce procès et en avait intenté de nombreux autres contre toute la Big Tech. Après l’annonce, l’action Alphabet, la maison mère de Google, progressait de 7 % dans les échanges informels, après la clôture de Wall Street, tandis que l’analyste gourou de Wedbush Securities, Dan Ives, parlait d’une « victoire monstre » pour le groupe. « Google est un monopole et il a agi comme tel pour maintenir son monopole », avait écrit, en août 2024, le juge Mehta, estimant que la firme avait conclu des accords de distribution exclusifs – par exemple avec Apple – pour s’assurer d’une part de marché supérieure à 90 %. Il vous reste 82.58% de cet article à lire. La suite est réservée aux abonnés. Lecture du Monde en cours sur un autre appareil. Vous pouvez lire Le Monde sur un seul appareil à la fois Ce message s’affichera sur l’autre appareil. Parce qu’une autre personne (ou vous) est en train de lire Le Monde avec ce compte sur un autre appareil. Vous ne pouvez lire Le Monde que sur un seul appareil à la fois (ordinateur, téléphone ou tablette). En cliquant sur « Continuer à lire ici » et en vous assurant que vous êtes la seule personne à consulter Le Monde avec ce compte. Nous vous conseillons de modifier votre mot de passe . Que se passera-t-il si vous continuez à lire ici ? Ce message s’affichera sur l’autre appareil. Ce dernier restera connecté avec ce compte. Non. Vous pouvez vous connecter avec votre compte sur autant d’appareils que vous le souhaitez, mais en les utilisant à des moments différents. Parce qu’une autre personne (ou vous) est en train de lire Le Monde avec ce compte sur un autre appareil. Vous ne pouvez lire Le Monde que sur un seul appareil à la fois (ordinateur, téléphone ou tablette). Si vous utilisez ce compte à plusieurs, créez un compte pour votre proche (inclus dans votre abonnement). Puis connectez-vous chacun avec vos identifiants. Sinon, cliquez sur « Continuer à lire ici » et assurez-vous que vous êtes la seule personne à consulter Le Monde avec ce compte. Vous ignorez qui d’autre utilise ces identifiants ? Nous vous conseillons de modifier votre mot de passe . Que se passera-t-il si vous continuez à lire ici ? Ce message s’affichera sur l’autre appareil. Ce dernier restera connecté avec ce compte. Non. Vous pouvez vous connecter avec votre compte sur autant d’appareils que vous le souhaitez, mais en les utilisant à des moments différents. Parce qu’une autre personne (ou vous) est en train de lire Le Monde avec ce compte sur un autre appareil. Vous ne pouvez lire Le Monde que sur un seul appareil à la fois (ordinateur, téléphone ou tablette). Si vous êtes bénéficiaire de l’abonnement, connectez-vous avec vos identifiants. Si vous êtes 3 ou plus à utiliser l’abonnement, passez à l’offre Famille . Sinon, cliquez sur « Continuer à lire ici » et assurez-vous que vous êtes la seule personne à consulter Le Monde avec ce compte. Vous ignorez qui d’autre utilise ces identifiants ? Nous vous conseillons de modifier votre mot de passe . Que se passera-t-il si vous continuez à lire ici ? Ce message s’affichera sur l’autre appareil. Ce dernier restera connecté avec ce compte. Non. Vous pouvez vous connecter avec votre compte sur autant d’appareils que vous le souhaitez, mais en les utilisant à des moments différents. Parce qu’une autre personne (ou vous) est en train de lire Le Monde avec ce compte sur un autre appareil. Vous ne pouvez lire Le Monde que sur un seul appareil à la fois (ordinateur, téléphone ou tablette). Si vous êtes bénéficiaire de l’abonnement, connectez-vous avec vos identifiants. Sinon, cliquez sur « Continuer à lire ici » et assurez-vous que vous êtes la seule personne à consulter Le Monde avec ce compte. Vous ignorez qui d’autre utilise ce compte ? Nous vous conseillons de modifier votre mot de passe . Que se passera-t-il si vous continuez à lire ici ? Ce message s’affichera sur l’autre appareil. Ce dernier restera connecté avec ce compte. Non. Vous pouvez vous connecter avec votre compte sur autant d’appareils que vous le souhaitez, mais en les utilisant à des moments différents. Parce qu’une autre personne (ou vous) est en train de lire Le Monde avec ce compte sur un autre appareil. Vous ne pouvez lire Le Monde que sur un seul appareil à la fois (ordinateur, téléphone ou tablette). Si vous utilisez ce compte à plusieurs, passez à une offre multicomptes pour faire profiter vos proches de votre abonnement avec leur propre compte. Sinon, cliquez sur « Continuer à lire ici » et assurez-vous que vous êtes la seule personne à consulter Le Monde avec ce compte. Vous ignorez qui d’autre utilise ce compte ? Nous vous conseillons de modifier votre mot de passe . Que se passera-t-il si vous continuez à lire ici ? Ce message s’affichera sur l’autre appareil. Ce dernier restera connecté avec ce compte. Non. Vous pouvez vous connecter avec votre compte sur autant d’appareils que vous le souhaitez, mais en les utilisant à des moments différents. Parce qu’une autre personne (ou vous) est en train de lire Le Monde avec ce compte sur un autre appareil. Vous ne pouvez lire Le Monde que sur un seul appareil à la fois (ordinateur, téléphone ou tablette). En cliquant sur « Continuer à lire ici » et en vous assurant que vous êtes la seule personne à consulter Le Monde avec ce compte. Que se passera-t-il si vous continuez à lire ici ? Ce message s’affichera sur l’autre appareil. Ce dernier restera connecté avec ce compte. Non. Vous pouvez vous connecter avec votre compte sur autant d’appareils que vous le souhaitez, mais en les utilisant à des moments différents. Nous vous conseillons de modifier votre mot de passe . Votre abonnement n’autorise pas la lecture de cet article Pour plus d’informations, merci de contacter notre service commercial.",2025-09-03 00:00:00,6460,lemonde.fr,fr
